{
  "schema_version": "1.0",
  "meta": { "title": "KRC Song", "artist": "Kugou Artist", "album": null, "by": null, "offset_ms": null, "source": "kugou" },
  "mode": "tracks",
  "tracks": [
    {
      "kind": "original",
      "source": "kugou",
      "document": {
        "meta": { "title": "KRC Song", "artist": "Kugou Artist", "album": null, "by": null, "offset_ms": null, "source": "kugou" },
        "lines": [
          {
            "start_ms": 2500,
            "duration_ms": 1800,
            "text": "光在前方",
            "words": [
              { "offset_ms": 2500, "duration_ms": 500, "text": "光" },
              { "offset_ms": 3000, "duration_ms": 700, "text": "在" },
              { "offset_ms": 3700, "duration_ms": 600, "text": "前方" }
            ]
          }
        ]
      },
      "quality": { "score": 95.0, "line_count": 1, "timed_line_count": 1, "word_timing_count": 3 }
    },
    {
      "kind": "translation",
      "language": "zh-Hant",
      "source": "kugou",
      "document": {
        "meta": { "title": "KRC Song", "artist": "Kugou Artist", "album": null, "by": null, "offset_ms": null, "source": "kugou" },
        "lines": [
          { "start_ms": 2500, "duration_ms": 1800, "text": "光在前方", "words": [], "translation": "The light is ahead" }
        ]
      },
      "quality": { "score": 75.0, "line_count": 1, "timed_line_count": 1, "word_timing_count": 0 }
    }
  ],
  "source_refs": ["kugou"],
  "score": { "final_score": 95.0, "timing_score": 95.0, "completeness_score": 100.0, "enrichment_score": 33.3 },
  "cache_refs": ["kugou:456:krc"]
}
