{
  "schema_version": "1.0",
  "meta": { "title": "QRC Song", "artist": "QQ Artist", "album": null, "by": null, "offset_ms": null, "source": "qq" },
  "mode": "tracks",
  "tracks": [
    {
      "kind": "original",
      "language": "zh-Hans",
      "source": "qq",
      "document": {
        "meta": { "title": "QRC Song", "artist": "QQ Artist", "album": null, "by": null, "offset_ms": null, "source": "qq" },
        "lines": [
          {
            "start_ms": 1000,
            "duration_ms": 1600,
            "text": "你好世界",
            "words": [
              { "offset_ms": 1000, "duration_ms": 400, "text": "你好" },
              { "offset_ms": 1400, "duration_ms": 600, "text": "世界" }
            ],
            "translation": "Hello world",
            "romanized": "ni hao shi jie"
          }
        ]
      },
      "quality": { "score": 98.0, "line_count": 1, "timed_line_count": 1, "word_timing_count": 2 }
    }
  ],
  "source_refs": ["qq"],
  "score": { "final_score": 98.0, "timing_score": 98.0, "completeness_score": 100.0, "enrichment_score": 0.0 },
  "cache_refs": ["qq:123:qrc"],
  "annotations": [
    { "annotation_type": "stress", "start_ms": 1000, "duration_ms": 400, "text": "你" },
    { "annotation_type": "breath", "start_ms": 1900, "duration_ms": 120, "text": "^" }
  ]
}
